{
  "$schema": "https://json-schema.org/draft/2020-12/schema",
  "$id": "urn:codeattest:protocol:v0:customer-facing-finding-record",
  "title": "Customer-Facing Finding Record",
  "type": "object",
  "additionalProperties": false,
  "required": [
    "protocol_version",
    "review_id",
    "customer_facing_finding_record_id",
    "review_finding_draft_ref",
    "expert_classification",
    "evidence_basis",
    "reviewer_remediation_guidance",
    "customer_remediation_status",
    "verification_state",
    "future_outcome_visibility",
    "evidence_consumer_export",
    "visibility",
    "source_derived_class"
  ],
  "properties": {
    "protocol_version": {
      "$ref": "urn:codeattest:protocol:v0:shared-definitions#/$defs/protocol_version"
    },
    "review_id": {
      "type": "string",
      "pattern": "^review:[a-z0-9][a-z0-9_-]{2,63}$"
    },
    "customer_facing_finding_record_id": {
      "type": "string",
      "pattern": "^customer_facing_finding:[a-z0-9][a-z0-9_-]{2,63}$"
    },
    "review_finding_draft_ref": {
      "type": "string",
      "pattern": "^review_finding_draft:[a-z0-9][a-z0-9_-]{2,63}$"
    },
    "classification_record_ref": {
      "type": "string",
      "pattern": "^classification_record:[a-z0-9][a-z0-9_-]{2,63}$"
    },
    "remediation_guidance_ref": {
      "type": "string",
      "pattern": "^remediation_guidance:[a-z0-9][a-z0-9_-]{2,63}$"
    },
    "customer_status_record_refs": {
      "type": "array",
      "maxItems": 10000,
      "minItems": 0,
      "uniqueItems": true,
      "items": {
        "type": "string",
        "pattern": "^customer_status:[a-z0-9][a-z0-9_-]{2,63}$"
      }
    },
    "verification_record_ref": {
      "type": "string",
      "pattern": "^verification_record:[a-z0-9][a-z0-9_-]{2,63}$"
    },
    "accepted_risk_record_ref": {
      "type": "string",
      "pattern": "^accepted_risk:[a-z0-9][a-z0-9_-]{2,63}$"
    },
    "false_positive_record_ref": {
      "type": "string",
      "pattern": "^false_positive:[a-z0-9][a-z0-9_-]{2,63}$"
    },
    "expert_classification": {
      "type": "object",
      "additionalProperties": false,
      "required": [
        "classification",
        "classification_record_ref",
        "rationale_summary",
        "criteria_summary",
        "limitations"
      ],
      "properties": {
        "classification": {
          "type": "string",
          "enum": [
            "likely",
            "confirmed",
            "inconclusive",
            "requires_customer_side_validation"
          ]
        },
        "classification_record_ref": {
          "type": "string",
          "pattern": "^classification_record:[a-z0-9][a-z0-9_-]{2,63}$"
        },
        "rationale_summary": {
          "$ref": "urn:codeattest:protocol:v0:shared-definitions#/$defs/non_empty_string"
        },
        "criteria_summary": {
          "$ref": "urn:codeattest:protocol:v0:shared-definitions#/$defs/non_empty_string"
        },
        "limitations": {
          "type": "array",
          "maxItems": 100,
          "minItems": 1,
          "items": {
            "$ref": "urn:codeattest:protocol:v0:shared-definitions#/$defs/narrative_string"
          }
        }
      }
    },
    "evidence_basis": {
      "type": "object",
      "additionalProperties": false,
      "required": [
        "evidence_refs",
        "source_reference_state",
        "limitations"
      ],
      "properties": {
        "evidence_refs": {
          "type": "array",
          "maxItems": 10000,
          "minItems": 1,
          "uniqueItems": true,
          "items": {
            "type": "string",
            "pattern": "^artifact_ref:[a-z0-9][a-z0-9_-]{2,63}$"
          }
        },
        "source_reference_state": {
          "type": "string",
          "enum": [
            "retained_review_artifact",
            "deleted_under_policy",
            "never_collected",
            "not_submitted_by_policy",
            "unresolved_reference"
          ]
        },
        "limitations": {
          "type": "array",
          "maxItems": 100,
          "minItems": 1,
          "items": {
            "$ref": "urn:codeattest:protocol:v0:shared-definitions#/$defs/narrative_string"
          }
        }
      }
    },
    "reviewer_remediation_guidance": {
      "type": "object",
      "additionalProperties": false,
      "required": [
        "guidance_status",
        "limitations"
      ],
      "properties": {
        "guidance_status": {
          "type": "string",
          "enum": [
            "actionable_guidance_provided",
            "limited_guidance_requires_validation",
            "guidance_unavailable_from_submitted_evidence"
          ]
        },
        "remediation_guidance_ref": {
          "type": "string",
          "pattern": "^remediation_guidance:[a-z0-9][a-z0-9_-]{2,63}$"
        },
        "exploitability_rationale_summary": {
          "$ref": "urn:codeattest:protocol:v0:shared-definitions#/$defs/non_empty_string"
        },
        "suggested_remediation_summary": {
          "$ref": "urn:codeattest:protocol:v0:shared-definitions#/$defs/non_empty_string"
        },
        "validation_step_summary": {
          "$ref": "urn:codeattest:protocol:v0:shared-definitions#/$defs/non_empty_string"
        },
        "next_step_summary": {
          "$ref": "urn:codeattest:protocol:v0:shared-definitions#/$defs/non_empty_string"
        },
        "validation_path_summary": {
          "$ref": "urn:codeattest:protocol:v0:shared-definitions#/$defs/non_empty_string"
        },
        "validation_path_ref": {
          "type": "string",
          "pattern": "^validation_path:[a-z0-9][a-z0-9_-]{2,63}$"
        },
        "insufficient_evidence_reason": {
          "$ref": "urn:codeattest:protocol:v0:shared-definitions#/$defs/non_empty_string"
        },
        "limitations": {
          "type": "array",
          "maxItems": 100,
          "minItems": 1,
          "items": {
            "$ref": "urn:codeattest:protocol:v0:shared-definitions#/$defs/narrative_string"
          }
        }
      }
    },
    "customer_remediation_status": {
      "type": "object",
      "additionalProperties": false,
      "required": [
        "latest_status",
        "customer_notes_visible"
      ],
      "properties": {
        "latest_status": {
          "type": "string",
          "enum": [
            "not_started",
            "planned",
            "in_progress",
            "remediated_by_customer",
            "validation_pending",
            "deferred",
            "not_applicable"
          ]
        },
        "latest_status_record_ref": {
          "type": "string",
          "pattern": "^customer_status:[a-z0-9][a-z0-9_-]{2,63}$"
        },
        "owner": {
          "$ref": "urn:codeattest:protocol:v0:shared-definitions#/$defs/non_empty_string"
        },
        "due_date": {
          "type": "string",
          "pattern": "^[0-9]{4}-[0-9]{2}-[0-9]{2}$"
        },
        "target_state": {
          "$ref": "urn:codeattest:protocol:v0:shared-definitions#/$defs/non_empty_string"
        },
        "customer_notes_summary": {
          "$ref": "urn:codeattest:protocol:v0:shared-definitions#/$defs/non_empty_string"
        },
        "customer_notes_visible": {
          "type": "boolean"
        }
      }
    },
    "verification_state": {
      "type": "object",
      "additionalProperties": false,
      "required": [
        "status",
        "summary"
      ],
      "properties": {
        "status": {
          "type": "string",
          "enum": [
            "not_verified",
            "verification_pending",
            "verification_complete",
            "requires_customer_side_validation"
          ]
        },
        "verification_record_ref": {
          "type": "string",
          "pattern": "^verification_record:[a-z0-9][a-z0-9_-]{2,63}$"
        },
        "summary": {
          "$ref": "urn:codeattest:protocol:v0:shared-definitions#/$defs/non_empty_string"
        }
      }
    },
    "future_outcome_visibility": {
      "type": "object",
      "additionalProperties": false,
      "required": [
        "accepted_risk_visible",
        "false_positive_visible"
      ],
      "properties": {
        "accepted_risk_visible": {
          "type": "boolean"
        },
        "accepted_risk_record_ref": {
          "type": "string",
          "pattern": "^accepted_risk:[a-z0-9][a-z0-9_-]{2,63}$"
        },
        "false_positive_visible": {
          "type": "boolean"
        },
        "false_positive_record_ref": {
          "type": "string",
          "pattern": "^false_positive:[a-z0-9][a-z0-9_-]{2,63}$"
        }
      }
    },
    "validation_paths": {
      "type": "array",
      "maxItems": 10000,
      "items": {
        "type": "object",
        "additionalProperties": false,
        "required": [
          "validation_path_ref",
          "path_type",
          "required_evidence",
          "steps",
          "expected_result",
          "limitations",
          "included_pass_verifiability"
        ],
        "properties": {
          "validation_path_ref": {
            "type": "string",
            "pattern": "^validation_path:[a-z0-9][a-z0-9_-]{2,63}$"
          },
          "path_type": {
            "type": "string",
            "enum": [
              "remote_dynamic_testing",
              "customer_run_script",
              "manual_steps"
            ]
          },
          "required_evidence": {
            "$ref": "urn:codeattest:protocol:v0:shared-definitions#/$defs/non_empty_string"
          },
          "steps": {
            "$ref": "urn:codeattest:protocol:v0:shared-definitions#/$defs/non_empty_string"
          },
          "expected_result": {
            "$ref": "urn:codeattest:protocol:v0:shared-definitions#/$defs/non_empty_string"
          },
          "limitations": {
            "type": "array",
            "maxItems": 100,
            "minItems": 1,
            "items": {
              "$ref": "urn:codeattest:protocol:v0:shared-definitions#/$defs/narrative_string"
            }
          },
          "included_pass_verifiability": {
            "type": "string",
            "enum": [
              "verifiable_within_included_pass",
              "customer_provided_evidence_required",
              "additional_agreement_required"
            ]
          },
          "reviewer_validation_script_refs": {
            "type": "array",
            "maxItems": 10000,
            "minItems": 1,
            "uniqueItems": true,
            "items": {
              "type": "string",
              "pattern": "^validation_script:[a-z0-9][a-z0-9_-]{2,63}$"
            }
          },
          "output_attachment_instructions": {
            "$ref": "urn:codeattest:protocol:v0:shared-definitions#/$defs/non_empty_string"
          },
          "target": {
            "$ref": "urn:codeattest:protocol:v0:shared-definitions#/$defs/non_empty_string"
          },
          "authorization_assumption": {
            "$ref": "urn:codeattest:protocol:v0:shared-definitions#/$defs/non_empty_string"
          },
          "method": {
            "$ref": "urn:codeattest:protocol:v0:shared-definitions#/$defs/non_empty_string"
          },
          "safety_constraints": {
            "$ref": "urn:codeattest:protocol:v0:shared-definitions#/$defs/non_empty_string"
          },
          "evidence_artifacts_to_collect": {
            "type": "array",
            "maxItems": 10000,
            "minItems": 1,
            "uniqueItems": true,
            "items": {
              "type": "string",
              "pattern": "^artifact_ref:[a-z0-9][a-z0-9_-]{2,63}$"
            }
          }
        }
      }
    },
    "reviewer_validation_scripts": {
      "type": "array",
      "maxItems": 10000,
      "items": {
        "type": "object",
        "additionalProperties": false,
        "required": [
          "validation_script_ref",
          "validation_path_ref",
          "script_package_status",
          "purpose",
          "prerequisites",
          "execution_steps",
          "expected_output",
          "safety_notes",
          "output_attachment_instructions",
          "script_content"
        ],
        "properties": {
          "validation_script_ref": {
            "type": "string",
            "pattern": "^validation_script:[a-z0-9][a-z0-9_-]{2,63}$"
          },
          "validation_path_ref": {
            "type": "string",
            "pattern": "^validation_path:[a-z0-9][a-z0-9_-]{2,63}$"
          },
          "script_package_status": {
            "type": "string",
            "enum": [
              "included_base_package",
              "additional_script_candidate_pricing_tbd"
            ]
          },
          "included_script_slot": {
            "type": "integer",
            "minimum": 1,
            "maximum": 3
          },
          "pricing_note": {
            "$ref": "urn:codeattest:protocol:v0:shared-definitions#/$defs/non_empty_string"
          },
          "purpose": {
            "$ref": "urn:codeattest:protocol:v0:shared-definitions#/$defs/non_empty_string"
          },
          "prerequisites": {
            "$ref": "urn:codeattest:protocol:v0:shared-definitions#/$defs/non_empty_string"
          },
          "execution_steps": {
            "$ref": "urn:codeattest:protocol:v0:shared-definitions#/$defs/non_empty_string"
          },
          "expected_output": {
            "$ref": "urn:codeattest:protocol:v0:shared-definitions#/$defs/non_empty_string"
          },
          "safety_notes": {
            "$ref": "urn:codeattest:protocol:v0:shared-definitions#/$defs/non_empty_string"
          },
          "output_attachment_instructions": {
            "$ref": "urn:codeattest:protocol:v0:shared-definitions#/$defs/non_empty_string"
          },
          "script_content": {
            "$ref": "urn:codeattest:protocol:v0:shared-definitions#/$defs/non_empty_string"
          }
        }
      }
    },
    "evidence_consumer_export": {
      "type": "string",
      "enum": [
        "include",
        "exclude"
      ]
    },
    "visibility": {
      "type": "string",
      "enum": [
        "customer_facing",
        "internal_only"
      ]
    },
    "source_derived_class": {
      "type": "string",
      "const": "retained_review_artifact"
    },
    "accepted_risk_outcome": {
      "type": "object",
      "additionalProperties": false,
      "required": [
        "accepted_risk_record_ref",
        "actor_category",
        "evidence_basis_summary",
        "evidence_refs",
        "customer_acceptance_summary",
        "limitations",
        "source_reference_state",
        "evidence_consumer_export"
      ],
      "properties": {
        "accepted_risk_record_ref": {
          "type": "string",
          "pattern": "^accepted_risk:[a-z0-9][a-z0-9_-]{2,63}$"
        },
        "actor_category": {
          "type": "string",
          "enum": [
            "customer_user",
            "reviewer",
            "vendor_service"
          ]
        },
        "evidence_basis_summary": {
          "$ref": "urn:codeattest:protocol:v0:shared-definitions#/$defs/non_empty_string"
        },
        "evidence_refs": {
          "type": "array",
          "maxItems": 10000,
          "minItems": 0,
          "uniqueItems": true,
          "items": {
            "type": "string",
            "pattern": "^artifact_ref:[a-z0-9][a-z0-9_-]{2,63}$"
          }
        },
        "customer_acceptance_summary": {
          "$ref": "urn:codeattest:protocol:v0:shared-definitions#/$defs/non_empty_string"
        },
        "risk_owner": {
          "$ref": "urn:codeattest:protocol:v0:shared-definitions#/$defs/non_empty_string"
        },
        "scope_of_acceptance": {
          "$ref": "urn:codeattest:protocol:v0:shared-definitions#/$defs/non_empty_string"
        },
        "review_by_date": {
          "type": "string",
          "pattern": "^[0-9]{4}-[0-9]{2}-[0-9]{2}$"
        },
        "remediation_context_ref": {
          "type": "string",
          "pattern": "^remediation_guidance:[a-z0-9][a-z0-9_-]{2,63}$"
        },
        "validation_path_ref": {
          "type": "string",
          "pattern": "^validation_path:[a-z0-9][a-z0-9_-]{2,63}$"
        },
        "limitations": {
          "type": "array",
          "maxItems": 100,
          "minItems": 1,
          "items": {
            "$ref": "urn:codeattest:protocol:v0:shared-definitions#/$defs/narrative_string"
          }
        },
        "source_reference_state": {
          "type": "string",
          "enum": [
            "retained_review_artifact",
            "deleted_under_policy",
            "never_collected",
            "not_submitted_by_policy",
            "unresolved_reference"
          ]
        },
        "evidence_consumer_export": {
          "type": "string",
          "enum": [
            "include",
            "exclude"
          ]
        }
      }
    },
    "false_positive_outcome": {
      "type": "object",
      "additionalProperties": false,
      "required": [
        "false_positive_record_ref",
        "actor_category",
        "evidence_basis_summary",
        "evidence_refs",
        "rationale_summary",
        "limitations",
        "source_reference_state",
        "evidence_consumer_export"
      ],
      "properties": {
        "false_positive_record_ref": {
          "type": "string",
          "pattern": "^false_positive:[a-z0-9][a-z0-9_-]{2,63}$"
        },
        "actor_category": {
          "type": "string",
          "const": "reviewer"
        },
        "evidence_basis_summary": {
          "$ref": "urn:codeattest:protocol:v0:shared-definitions#/$defs/non_empty_string"
        },
        "evidence_refs": {
          "type": "array",
          "maxItems": 10000,
          "minItems": 0,
          "uniqueItems": true,
          "items": {
            "type": "string",
            "pattern": "^artifact_ref:[a-z0-9][a-z0-9_-]{2,63}$"
          }
        },
        "rationale_summary": {
          "$ref": "urn:codeattest:protocol:v0:shared-definitions#/$defs/non_empty_string"
        },
        "candidate_finding_refs": {
          "type": "array",
          "maxItems": 10000,
          "minItems": 1,
          "uniqueItems": true,
          "items": {
            "type": "string",
            "pattern": "^candidate_finding:[a-z0-9][a-z0-9_-]{2,63}$"
          }
        },
        "limitations": {
          "type": "array",
          "maxItems": 100,
          "minItems": 1,
          "items": {
            "$ref": "urn:codeattest:protocol:v0:shared-definitions#/$defs/narrative_string"
          }
        },
        "source_reference_state": {
          "type": "string",
          "enum": [
            "retained_review_artifact",
            "deleted_under_policy",
            "never_collected",
            "not_submitted_by_policy",
            "unresolved_reference"
          ]
        },
        "evidence_consumer_export": {
          "type": "string",
          "enum": [
            "include",
            "exclude"
          ]
        }
      }
    }
  }
}
